pid,product_name,product_category_tree,retail_price,discounted_price,image,description,brand,product_specifications,section,category,subcategory1,subcategory2,subcategory3,subcategory4,bias,sale_percentage,tags
EL76112,Asus ROG Zephyrus G16,Electronics >> Laptops >> Premium Laptops >> Asus Laptops,227990,192999,"[""https://www.reliancedigital.in/medias/Asus-Gaming-Laptop-494352431-i-1-1200Wx1200H?context=bWFzdGVyfGltYWdlc3wxNDA2Mjl8aW1hZ2UvanBlZ3xpbWFnZXMvaDYxL2hlNy8xMDExNTY3ODQwNDYzOC5qcGd8MjM3ZmEyYTEyMTlmYTVlMmQ0YjJkZTE4Yjg0MWY1YTYyMDdiYzdhOGRjM2JkMGFmMGFiNTVkN2EyYTA5MDczMA""]","The Asus ROG Zephyrus G16 features an Intel Core Ultra 7 processor, NVIDIA RTX 4070 graphics, 16 GB RAM, 1 TB SSD storage, and a 40.64 cm (16-inch) 2.5K display. It comes with Windows 11 Home OS.",Asus,"{""product_specification"": [{""Processor"":""Intel Core Ultra 7""}, {""Graphics"":""NVIDIA RTX 4070""}, {""RAM"":""16 GB""}, {""Internal Storage"":""1 TB""}, {""Display"":""40.64 cm (16-inch) 2.5K""}, {""Operating System"":""Windows 11 Home""}]}",Electronics,Laptops,Premium Laptops,Asus Laptops,,,A,15.34760297,
EL81264,ASUS HN024W TUF F15 AI Powered Gaming Laptop,Electronics >> Laptops >> Premium Laptops >> Asus Laptops,75900,50999,"[""https://www.reliancedigital.in/asus-hn024w-tuf-f15-ai-powered-gaming-laptop-11th-gen-intel-core-i5-11400h-8gb-512-ssd-4-gb-graphics-nvidia-geforce-rtx-2050-144-hz-70-w-window-11-home-fhd-35-56-cm-15-6-inch-/p/493837971""]","ASUS HN024W TUF F15 AI Powered Gaming Laptop features an 11th Gen Intel Core i5-11400H processor, 8GB RAM, 512GB SSD storage, and NVIDIA GeForce RTX 2050 graphics card. It boasts a 15.6-inch Full HD display with a refresh rate of 144Hz, providing an immersive gaming experience. Running on Windows 11 Home, this laptop offers powerful performance for gaming and productivity tasks.",ASUS,"{""product_specification"": [{""Processor"":""11th Gen Intel Core i5-11400H Processor""}, {""RAM"":""8GB""}, {""Internal Storage"":""512GB""}, {""Storage Type"":""SSD""}, {""Operating System"":""Windows 11 Home""}, {""Microsoft Office included"":""No""}, {""Warranty"":""1 Year manufacturer warranty""}]}",Electronics,Laptops,Premium Laptops,Asus Laptops,,,A,32.80764163,"[""#office""]"
EL36975,Apple MacBook Air,Electronics >> Laptops >> Premium Laptops >> Apple Laptops,174900,174900,"[""https://www.reliancedigital.in/medias/Macbook-SG-Laptop-494352780-i-1-1200Wx1200H?context=bWFzdGVyfGltYWdlc3w4MzUzMXxpbWFnZS9qcGVnfGltYWdlcy9oNGEvaGNlLzEwMTE2OTk3MTg1NTY2LmpwZ3xmNWYyYjhmZjhhODQzNDhhYjg1ZjNlYTJhZWVjNDk5MTcwNjgyNTYyNGVkNTAxMmY4ZmNjMDA1MTAzMzA4Y2I4""]","The Apple MacBook Air features an Apple M3 Chip/8C CPU/10C GPU processor, 16GB RAM, and a 512GB SSD. It runs on MacOS Sonoma and has a 38.86 cm (15.3 inch) Liquid Retina Display. This model comes in Space Grey.",Apple,"{""product_specification"": [{""Processor"":""Apple M3 Chip/8C CPU/10C GPU""}, {""RAM"":""16 GB""}, {""Internal Storage"":""512 GB SSD""}, {""Operating System"":""MacOS Sonoma""}, {""Display"":""38.86 cm (15.3 inch) Liquid Retina""}, {""Color"":""Space Grey""}],""Warranty"":""1 Year manufacturer warranty""}",Electronics,Laptops,Premium Laptops,Apple Laptops,,,A,0,
EL69048,Apple MLY33HNA MacBook Air,Electronics >> Laptops >> Premium Laptops >> Apple Laptops,99900,92990,"[""https://www.reliancedigital.in/medias/Apple-MLY33HN-A-Laptop-492850656-i-1-1200Wx1200H?context=bWFzdGVyfGltYWdlc3w5OTE3OXxpbWFnZS9qcGVnfGltYWdlcy9oMGYvaDMxLzk4NTA5NDkxNzMyNzguanBnfGM5NWY2ZmFmNGU0NjA1NDJhMDNkMmM1ZTQyYWY0NGQ1NGY5YTYxY2JlM2Q4MWYzZDRiODQyM2NhNTMxOGQ5MWU""]","The Apple MLY33HNA MacBook Air features the Apple M2 chip, 8GB RAM, 256GB SSD storage, macOS Monterey, Liquid Retina display, and a 34.46 cm (13.6-inch) screen. It provides a powerful and efficient computing experience in a sleek and lightweight design.",Apple,"{""product_specification"": [{""Processor"":""Apple M2 Chip Processor""}, {""RAM"":""8 GB""}, {""Internal Storage"":""256 GB SSD""}, {""Storage Type"":""SSD""}, {""Operating System"":""macOS Monterey""}, {""Microsoft Office Included"":""No""}, {""Warranty"":""1 Year manufacturer warranty""}]}",Electronics,Laptops,Premium Laptops,Apple Laptops,,,A,6.916916917,"[""#office""]"
EL18693,Apple MacBook Air (Apple M2 Chip),Electronics >> Laptops >> Premium Laptops >> Apple Laptops,99900,92990,"[""https://www.reliancedigital.in/medias/Apple-MLXW3HN-A-Laptop-492850650-i-1-1200Wx1200H?context=bWFzdGVyfGltYWdlc3w5NDkxNHxpbWFnZS9qcGVnfGltYWdlcy9oNjEvaDg2Lzk4NTA5NDcyMDcxOTguanBnfGI1ZWNlZDRlNTRlODczNWU1YzdlNzdkMGRhY2VjMjY4NDM4ZDNlNDEwODczMzgxYTY0M2MxNTMyY2MxMTYxODE""]","The Apple MacBook Air features the powerful Apple M2 chip, 8GB RAM, 256GB SSD storage, macOS Monterey, Liquid Retina display (34.46 cm / 13.6-inch), and comes in space grey color. It offers exceptional performance and a stunning display for productivity and entertainment.",Apple,"{""product_specification"": [{""Processor"":""Apple M2 Chip Processor""}, {""RAM"":""8GB""}, {""Internal Storage"":""256GB SSD""}, {""Storage Type"":""SSD""}, {""Operating System"":""macOS Monterey""}, {""Microsoft Office Included"":""No""}, {""Warranty"":""1 Year manufacturer warranty""}]}",Electronics,Laptops,Premium Laptops,Apple Laptops,,,A,6.916916917,"[""#office""]"
EL22691,Apple MacBook Air,Electronics >> Laptops >> Premium Laptops >> Apple Laptops,89990,80990,"[""https://www.reliancedigital.in/medias/Apple-MGN63HNA-Laptops-491946461-i-1-1200Wx1200H?context=bWFzdGVyfGltYWdlc3wxNzczNDJ8aW1hZ2UvanBlZ3xpbWFnZXMvaDVhL2gyZC85NDQzMDgzNTgzNTE4LmpwZ3xhYzRiNWIxZGQ2NjNiNWIyYjI0Y2ZkYTZlZWQ3MTFjZTMxYzVmNDBiNmM5Mzk5OTM2OGVkZmExMjMyYjIxNDQ4""]","The Apple MacBook Air MGN63HNA features an octa-core Apple M1 chip processor, 8GB RAM, 256GB SSD storage, MacOS, and a 13.3-inch Retina display. It offers powerful performance, long battery life, and a sleek design, making it perfect for work and everyday use.",Apple,"{""product_specification"": [{""Processor"":""Octa-core Apple M1 Chip""}, {""RAM"":""8 GB""}, {""Internal Storage"":""256 GB SSD""}, {""Storage Type"":""SSD""}, {""Operating System"":""macOS""}, {""Microsoft Office Included"":""No""}, {""Warranty"":""1 Year manufacturer warranty""}]}",Electronics,Laptops,Premium Laptops,Apple Laptops,,,A,10.00111123,
EL50080,Acer Aspire Lite 11th Gen Intel Core i7 Laptop,Electronics >> Laptops >> Premium Laptops >> Acer Laptops,74999,44999,"[""https://www.reliancedigital.in/medias/Acer-Aspire-Lite-11th-Gen-Intel-Core-i7-Laptop-493839149-i-1-1200Wx1200H?context=bWFzdGVyfGltYWdlc3w0NDczNDl8aW1hZ2UvanBlZ3xpbWFnZXMvaDQ3L2hhMy8xMDA1MDU1NzY3MzUwMi5qcGd8ZDg0OTRiY2UxZGYzNTBhYzIxMzdkYzdjMjhjYTcwOTE4MThiYzJiZWRmZGIyNzc3ZjQwMmJmZjU2MmY0M2U3Yw""]","The Acer Aspire Lite 11th Gen Intel Core i7 Laptop features an 11th Gen Intel Core i7 processor, Windows 11 Home, 16 GB RAM, 512 GB SSD, Intel Iris Xe Graphics, Microsoft Office, and a 39.6 cm (15.6-inch) Full HD TN TFT LCD display in steel gray color.",Acer,"{""product_specification"": [{""Processor"":""11th Gen Intel Core i7""}, {""Operating System"":""Windows 11 Home""}, {""RAM"":""16 GB""}, {""Internal Storage"":""512 GB SSD""}, {""Graphics"":""Intel Iris Xe Graphics""}, {""Microsoft Office"":""Included""}, {""Display"":""39.6 cm (15.6-inch) Full HD TN TFT LCD""}, {""Warranty"":""1 Year manufacturer warranty""}, {""Key Features"":""180 angle Hinge Design with (Fn+R Screen Rotate Feature), Narrow Bezel (83 percent Body to Screen Ratio), Card Reader - Micro SD Card Reader, Metal-Alloy Body (A & D Cover), Light Weight Starting 1.59 Kg, Sleek and Stylish Design, Dual Storage Capable""}]}",Electronics,Laptops,Premium Laptops,Acer Laptops,,,A,40.00053334,
EL28310,ASUS NK321WS VivoBook Go 14 Laptop,Electronics >> Laptops >> Mid-End Laptops >> Asus Laptops,50990,34542,"[""https://www.reliancedigital.in/medias/Asus-Vivobook-NK321WS-493665872-i-1-1200Wx1200H?context=bWFzdGVyfGltYWdlc3w0ODA0M3xpbWFnZS9qcGVnfGltYWdlcy9oYTEvaGQ1LzEwMDIyNDU0NzU1MzU4LmpwZ3xjZDNhYWUzNzdhZDIyMmZhOGQxODM3MWQ1NTMwOTE3NzU0ZWE1YjdhZTA2OGUwZGVmOWZhNzkwNGI1YWU4NzFj""]","The ASUS NK321WS VivoBook Go 14 Laptop features an AMD Ryzen 3 7320U processor, 8GB RAM, 512GB SSD storage, Windows 11 Home OS, and a 34.03 cm (14.0-inch) Full HD display. It offers a compact and lightweight design, making it ideal for on-the-go productivity.",ASUS,"{""product_specification"": [{""Processor"":""AMD Ryzen 3 7320U Processor""}, {""RAM"":""8GB""}, {""Internal Storage"":""512GB SSD""}, {""Storage Type"":""SSD""}, {""Operating System"":""Windows 11 Home""}, {""Microsoft Office included"":""FALSE""}, {""Warranty"":""1 Year manufacturer warranty""}]}",Electronics,Laptops,Mid-End Laptops,Asus Laptops,,,A,32.25730535,
EL59928,Lenovo 5XIN Ideapad G3 Gaming Laptop AMD Ryzen R5-5600H 16 GB 512 GB SSD NVIDIA GeForce GTX 1650 4 GB RAM Windows 11 MSO FHD 39.62 cm (15.6 inch),Electronics >> Laptops >> High End Laptops >> Lenovo Laptops,104800,48274,"[""https://www.reliancedigital.in/medias/Ideapad-Gaming-Laptop-493838874-i-1-1200Wx1200H?context=bWFzdGVyfGltYWdlc3w4OTQwMHxpbWFnZS9qcGVnfGltYWdlcy9oN2QvaDY4LzEwMDQwMDU2NjQzNjE0LmpwZ3w1OTgyMWU0ZmQ0ZmE5MjhlMzAzODlhY2MxZTRjN2FlZDllZjJlMDhiN2FjNTM4ODYxNTNjZjczOGM0Y2E5ZmZi""]","The Lenovo 5XIN Ideapad G3 Gaming Laptop features an AMD Ryzen R5-5600H processor, 16 GB of RAM, and 512 GB SSD storage. Equipped with an NVIDIA GeForce GTX 1650 graphics card and a 15.6-inch Full HD display, this laptop delivers smooth gaming experiences. It runs on Windows 11 and includes Microsoft Office. Ideal for gaming and productivity tasks.",Lenovo,"{""product_specification"": [{""Processor"":""AMD Ryzen R5-5600H""}, {""RAM"":""16GB""}, {""Internal Storage"":""512GB""}, {""Storage Type"":""SSD""}, {""Operating System"":""Windows 11""}, {""Microsoft Office"":""Yes""}, {""Warranty"":""1 Year manufacturer warranty""}]}",Electronics,Laptops,High End Laptops,Lenovo Laptops,,,A,53.9370229,
EL11243,HP 15s-eq2144AU Laptop,Electronics >> Laptops >> High End Laptops >> HP Laptops,60959,38610,"[""https://www.reliancedigital.in/medias/HP15s-EQ2144AU-Laptop-492575360-i-1-1200Wx1200H?context=bWFzdGVyfGltYWdlc3wxNTc4ODh8aW1hZ2UvanBlZ3xpbWFnZXMvaDI4L2g1Ny85ODIyNTYwOTc2OTI2LmpwZ3xjYzY4NmJiNDkyZmQzYzk4MzQ3NDY1YWRkN2FmNzcwYmMyMGFlNjBjNzY5MDQ0YzFhNzIxNjQyMTdkMWUyMzRm""]","The HP 15s-eq2144AU laptop features an AMD Ryzen 5 5500U processor, 8GB RAM, 512GB SSD storage, AMD Radeon Graphics, Windows 11 OS, and a 39.6 cm (15.6-inch) Full HD display. It offers reliable performance and ample storage for various tasks.",HP,"{""product_specification"": [{""Processor"":""AMD Ryzen 5 5500U Processor""}, {""RAM"":""8 GB""}, {""Internal Storage"":""512 GB SSD""}, {""Storage Type"":""SSD""}, {""Operating System"":""Windows 11""}, {""Microsoft Office Included"":""Yes""}, {""Warranty"":""1 Year manufacturer warranty""}]}",Electronics,Laptops,High End Laptops,HP Laptops,,,A,36.66234682,"[""#office""]"
EL91890,HP 14s-fq1089AU Laptop,Electronics >> Laptops >> High End Laptops >> HP Laptops,52900,33110,"[""https://www.reliancedigital.in/medias/HP-50M59PA-ACJ-LAPTOP-492575116-i-1-1200Wx1200H?context=bWFzdGVyfGltYWdlc3w5NjczOHxpbWFnZS9qcGVnfGltYWdlcy9oNjQvaDhlLzk4MzU0ODA3MTExOTguanBnfDE0NmZkYzdiYWM0ZjFhYjNjZDYxZmVhYjZkMGMwM2YzZWYyZWEzZmIwYjkzMGY4OWE5NzcyNTEzNmRkY2I1YTA""]","The HP 14s-fq1089AU laptop features an AMD Ryzen 3 5300U processor, 8 GB RAM, 512 GB SSD storage, Windows 11 OS, and a 14-inch Full HD display. It provides reliable performance and portability for various tasks. Microsoft Office is included for productivity.",HP,"{""product_specification"": [{""Processor"":""AMD Ryzen 3 5300U""}, {""RAM"":""8 GB""}, {""Internal Storage"":""512 GB SSD""}, {""Storage Type"":""SSD""}, {""Operating System"":""Windows 11""}, {""Microsoft Office Included"":""Yes""}, {""Warranty"":""1 Year manufacturer warranty""}]}",Electronics,Laptops,High End Laptops,HP Laptops,,,A,37.41020794,
EL22062,Avita Liber V14 Laptop,Electronics >> Laptops >> High End Laptops >> AVITA Laptops,63990,47499,"[""https://www.reliancedigital.in/medias/AVITA-A8INF561-Laptops-491998002-i-1-1200Wx1200H?context=bWFzdGVyfGltYWdlc3wxNzM2MTV8aW1hZ2UvanBlZ3xpbWFnZXMvaDAzL2gyYS85Njc3MDg5NDA3MDA2LmpwZ3wzNDFmYTJiMGJhMzJhNjkxM2RhZDk1ZmMyZjY3NDAwNDI4ZDdjMmMzYTA5OGUxZWMyYzIwZjY2ODFhN2E1NWE4""]","The Avita Liber V14 Laptop features a 10th Gen Intel Core i5-10210U processor, 8 GB RAM, 512 GB SSD storage, and runs on Windows 10 operating system. It offers a sleek design and reliable performance for everyday computing tasks.",Avita,"{""product_specification"": [{""Processor"":""10th Gen Intel Core i5-10210U""}, {""RAM"":""8 GB""}, {""Internal Storage"":""512 GB""}, {""Operating System"":""Windows 10""}, {""Warranty"":""2 Years manufacturer warranty""}]}",Electronics,Laptops,High End Laptops,AVITA Laptops,,,A,25.77121425,
EL97419,ASUS MB511WS VivoBook 16X Laptop,Electronics >> Laptops >> High End Laptops >> ASUS Laptops,74990,51999,"[""https://www.reliancedigital.in/medias/Asus-M1603QA-MB511WS-Laptops-492850644-i-1-1200Wx1200H?context=bWFzdGVyfGltYWdlc3wxMzM4Njk5fGltYWdlL2pwZWd8aW1hZ2VzL2g4MS9oMDQvOTg1MTU4NjUxMDg3OC5qcGd8Y2I4OTEyZmRmNzM2NzI3MTc4NjlmNzAwZGY0YTg5YTI0NTQ0ZTc2MzAyNDI5ZGJhZTM3OTk2ODFkNzUxYzM5Zg""]","The ASUS MB511WS VivoBook 16X laptop features an AMD Ryzen 5 5600H processor, 16 GB RAM, 512 GB SSD storage, AMD Radeon Vega 7 Graphics, 2K display, Windows 11 OS, and a WUXGA screen. It provides powerful performance and stunning visuals for work and entertainment. The laptop also includes exceptional heat dissipation, an ASUS ErgoSense keyboard, ASUS Antibacterial Guard, integrated privacy shield, built-in fingerprint sensor, and WiFi 6 technology for enhanced connectivity.",ASUS,"{""product_specification"": [{""Processor"":""AMD Ryzen 5 5600H Mobile Processor""}, {""RAM"":""16 GB""}, {""Internal Storage"":""512 GB SSD""}, {""Graphics"":""AMD Radeon Vega 7 Graphics""}, {""Display"":""2K WUXGA""}, {""Operating System"":""Windows 11""}, {""Key Features"":""Exceptional heat dissipation, IceBlades fan, Lightweight design, 180 degree lay-flat hinge, ASUS ErgoSense keyboard, ASUS Antibacterial Guard, Integrated privacy shield, Built-in fingerprint sensor, WiFi 6 technology""}, {""Warranty"":""1 Year manufacturer warranty""}]}",Electronics,Laptops,High End Laptops,ASUS Laptops,,,A,30.6587545,
EL31942,HP Victus 15-FA0998TX Gaming Laptop,Electronics >> Laptops >> Gaming Laptops >> HP Laptops,90403,68399,"[""https://www.reliancedigital.in/medias/HP-V15-fa0998TX-493837767-i-1-1200Wx1200H?context=bWFzdGVyfGltYWdlc3wxODQ4MDA0fGltYWdlL2pwZWd8aW1hZ2VzL2g2Yi9oYTIvMTAwMTE4NDcyOTUwMDYuanBnfDQxZWQwNGE3ZmY4MGNhNDBmN2RkMDRhZjdjYWMyOTI0YTY3MjU0YjE0NzJiOWE4NTFlYzk5NDc1ZjY3Nzg0ZDE""]","The HP Victus 15-FA0998TX Gaming Laptop is powered by a 12th Gen Intel Core i5-12450H processor, 16 GB of RAM, and a 512 GB SSD. It features NVIDIA GeForce graphics and runs on Windows 11 Home. With a 15.6-inch Full HD display, this laptop delivers immersive gaming experiences. Microsoft Office is not included. It comes with a 1-year manufacturer warranty.",HP,"{""product_specification"": [{""Processor"":""12th Gen Intel Core i5-12450H""}, {""RAM"":""16 GB""}, {""Internal Storage"":""512 GB SSD""}, {""Storage Type"":""SSD""}, {""Graphics"":""NVIDIA GeForce""}, {""Operating System"":""Windows 11 Home""}, {""Microsoft Office included"":""FALSE""}, {""Display"":""15.6-inch Full HD""}, {""Warranty"":""1 Year manufacturer warranty""}, {""Product Type"":""Gaming Laptop""}]}",Electronics,Laptops,Gaming Laptops,HP Laptops,,,A,24.33990022,
EL96339,HP Envy 360 13-BF0121TU Laptop,Electronics >> Laptops >> Gaming Laptops >> HP Laptops,100270,80969,"[""https://www.reliancedigital.in/medias/HP-Envy-bf0121TU-493664897-i-1-1200Wx1200H?context=bWFzdGVyfGltYWdlc3w3NzI4OXxpbWFnZS9qcGVnfGltYWdlcy9oMmYvaGNjLzEwMDIxNTE3Nzg3MTY2LmpwZ3xiMmY0ZmZhY2JmYjcyZWUwMDhjZWE0MTEwYmI4ZTQ5NWE1NTVjOGUxODVkOWJhMWU3NmEyYTdhYmQyMjZmMmQx""]","The HP Envy 360 13-BF0121TU Laptop features a 12th Gen Intel Core Evo i5-1230U processor, 16 GB of RAM, and a 512 GB SSD. It comes with Intel Xe Graphics and runs on Windows 11 Home. With a 13.3-inch Full HD display, this laptop offers a versatile computing experience. Microsoft Office is included. It comes with a 1-year manufacturer warranty.",HP,"{""product_specification"": [{""Processor"":""Intel Core Evo i5-1230U""}, {""RAM"":""16GB""}, {""Internal Storage"":""512 GB SSD""}, {""Storage Type"":""SSD""}, {""Operating System"":""Windows 11 Home""}, {""Display"":""13.3-inch Full HD""}, {""Microsoft Office included"":""Yes""}, {""Warranty"":""1 Year manufacturer warranty""}, {""Product Type"":""Convertible Laptop""}]}",Electronics,Laptops,Gaming Laptops,HP Laptops,,,A,19.24902763,
EL34142,JioBook,Electronics >> Laptops >> Entry Level Laptops >> JIO Laptops,25000,14499,"[""https://www.reliancedigital.in/medias/JioBook11-Ultimate-NB1112MM-492337955-i-1-1200Wx1200H?context=bWFzdGVyfGltYWdlc3wyNzM4Njd8aW1hZ2UvanBlZ3xpbWFnZXMvaDg4L2gzZC8xMDExNDUzMTQ5MTg3MC5qcGd8NmUyNGVmODU3ODcyN2JlNTg4ZDI3ZmYwZTc1NzU5YjdhNTgyZTY4YTZhZTNlNzhmMDIxZjM0Y2JjMDFjN2Q3NQ""]","The JioBook is designed as the ultimate learning partner, featuring a MediaTek 2.0 GHz octa-core processor, 4 GB LPDDR4 RAM, 64 GB eMMC storage, 4G LTE connectivity, JioOS, expandable storage up to 256 GB, and an 11.6-inch display. It caters to entry-level laptop users, providing essential features for education and basic computing tasks.",JIO,"{""product_specification"": [{""Processor"":""MediaTek 2.0 GHz Octa-Core""}, {""RAM"":""4 GB LPDDR4""}, {""Internal Storage"":""64 GB eMMC""}, {""Connectivity"":""4G LTE""}, {""Operating System"":""JioOS""}, {""Expandable Storage"":""Up to 256 GB""}, {""Display"":""29.46 cm (11.6-inch)""}]}",Electronics,Laptops,Entry Level Laptops,JIO Laptops,,,A,42.004,
EL20328,Infinix INBook Y1 Plus Thin & Light Laptop,Electronics >> Laptops >> Entry Level Laptops >> Infinix Laptops,44999,25999,"[""https://www.reliancedigital.in/medias/Infinix-Y1-Plus-Laptop-493665886-i-1-1200Wx1200H?context=bWFzdGVyfGltYWdlc3w5MTY4N3xpbWFnZS9qcGVnfGltYWdlcy9oNTUvaGQ3Lzk5ODExMjkzMjY2MjIuanBnfDMxOTg1NmNhYTU0ZWE1NjNhZmMzZTRlY2IxNDdmZWYyZDM2NmExNGE2YzRiNjE0OTU2MGI1ZjBmZTYwMTA5YTQ""]","The Infinix INBook Y1 Plus is a thin and light laptop featuring a 10th Gen Intel Core i3-1005G1 processor, 8 GB RAM, 256 GB SSD, UHD Graphics, Windows 11 Home, and a 15.6-inch Full HD display. It offers a balance of performance and portability for everyday computing tasks.",Infinix,"{""product_specification"": [{""Processor"":""10th Gen Intel Core i3-1005G1""}, {""RAM"":""8 GB""}, {""Internal Storage"":""256 GB SSD""}, {""Graphics"":""UHD Graphics""}, {""Operating System"":""Windows 11 Home""}, {""Display"":""39.62 cm (15.6-inch) FHD""}]}",Electronics,Laptops,Entry Level Laptops,Infinix Laptops,,,A,42.22316051,
EL52978,AXL Vayu Book Thin and Light Laptop,Electronics >> Laptops >> Entry Level Laptops >> AXL Vayu Book Laptops,31990,17999,"[""https://www.reliancedigital.in/medias/AXL-Lap01-Laptops-493665131-i-1-1200Wx1200H?context=bWFzdGVyfGltYWdlc3w3MTY1MXxpbWFnZS9qcGVnfGltYWdlcy9oYzQvaDEyLzk5NjM3Mzg1NjI1OTAuanBnfGYzN2NlYmZlMzBmMTZlMTU3NzA2MmI0NmYyN2U1ZDMwNTM0YTJiMzYwMjA2NWViNGRjZDU0MTY4MzQwZGE4OTQ""]","The AXL Vayu Book Thin and Light Laptop features an Intel Celeron N4020 processor, 4GB RAM, 128GB SSD storage, UHD Graphics, Windows 11 Home OS, and a 35.81 cm (14.1-inch) Full HD display. It provides lightweight and portable computing for everyday tasks.",AXL,"{""product_specification"": [{""Processor"":""Intel Celeron N4020 Processor""}, {""RAM"":""4GB""}, {""Internal Storage"":""128GB SSD""}, {""Storage Type"":""SSD""}, {""Operating System"":""Windows 11 Home""}, {""Warranty"":""1 Year manufacturer warranty""}]}",Electronics,Laptops,Entry Level Laptops,AXL Vayu Book Laptops,,,A,43.73554236,
EL74311,Avita Pura E NS14A6ING541 Laptop,Electronics >> Laptops >> Entry Level Laptops >> AVITA Laptops,33490,24499,"[""https://www.reliancedigital.in/medias/AVITA-PURA-NS14A6ING541-G-Laptop-492573436-i-1-1200Wx1200H?context=bWFzdGVyfGltYWdlc3wxMTg2MTl8aW1hZ2UvanBlZ3xpbWFnZXMvaDNiL2gwNi85Njc3MjM2MzA1OTUwLmpwZ3w1OWJhYjg4NDNmY2IyYzA1NTBkNDcyMzMwZWE4NDQxY2E2ZTlkYzFiYWIwNzgxZTY0YjIyMTQ1YmRlYTJhNzEw""]","The Avita Pura E NS14A6ING541 Laptop features an AMD A6-9220E processor, 8 GB RAM, 256 GB SSD storage, and runs on Windows 10 operating system. It comes with a 35.56 cm (14-inch) Full HD display.",Avita,"{""product_specification"": [{""Processor"":""AMD A6-9220E""}, {""RAM"":""8 GB""}, {""Internal Storage"":""256 GB SSD""}, {""Storage Type"":""SSD""}, {""Operating System"":""Windows 10""}, {""Display"":""35.56 cm (14-inch) Full HD""}, {""Warranty"":""2 Years manufacturer warranty""}]}",Electronics,Laptops,Entry Level Laptops,AVITA Laptops,,,A,26.84681995,
CL25240,H&M Women Black Short Jersey Top,Clothing >> Women's Clothing >> Tops >> H&M Tops,699,699,"[""https://assets.myntassets.com/h_1440,q_100,w_1080/v1/assets/images/17347470/2022/3/2/7f210397-980a-48c6-af8e-f31722e025151646210839441Shortjerseytop1.jpg""]","Soft cotton jersey top with a round neckline and long sleeves. Perfect for casual wear, it features a crop length and regular fit. Crafted from 95% cotton and 5% elastane for comfort and stretch. Machine washable for easy care. Ideal for pairing with high-waisted jeans or skirts.",H&M,"{""product_specification"": [{""Sleeve Length"":""Long Sleeves""}, {""Neck"":""Round Neck""}, {""Type"":""Regular""}, {""Print or Pattern Type"":""Solid""}, {""Sleeve Styling"":""Regular Sleeves""}, {""Transparency"":""Opaque""}, {""Length"":""Crop""}, {""Main Trend"":""New Basics""}, {""Occasion"":""Casual""}, {""Weave Type"":""Knitted""}]}",Clothing,Women's Clothing,Tops,H&M Tops,,,W,0,"[""#party""]"
CL77023,Calvin Klein Performance Women's Short Sleeve T-Shirt,Clothing >> Women's Clothing >> T-shirts >> Short Sleeve T-shirts >> Calvin Klein T-shirts,3275,1832,"[""https://m.media-amazon.com/images/I/41xQ0s+9drL._AC_SR38,50_.jpg"",""https://m.media-amazon.com/images/I/41OiAN601ML._AC_SR38,50_.jpg"",""https://m.media-amazon.com/images/I/41ISgfgsjyL._AC_SR38,50_.jpg"",""https://m.media-amazon.com/images/I/31Wb5qClTsL._AC_SR38,50_.jpg""]","Calvin Klein Performance creates active clothing for women that can be worn to the gym or for casual everyday wear. A special focus for Calvin Klein Performance is capturing fun, fashion trends and using 'easy-to-care' fabrics to keep you looking stylish and comfortable for your workouts and all your casual activities",Calvin Klein,"{""product_specification"": [{""Fabric type"":""60% Cotton, 40% Modal""}, {""Care instructions"":""Machine Wash""}, {""Origin"":""Imported""}, {""Closure type"":""Pull On""}]}",Clothing,Women's Clothing,T-shirts,Short Sleeve T-shirts,Calvin Klein T-shirts,,W,44.0610687,"[""#party""]"
CL33204,Roadster Women Green Cotton Relaxed Fit T-shirt,Clothing >> Women's Clothing >> T-shirts >> Roadster T-shirts,699,237,"[""https://assets.myntassets.com/assets/images/14342318/2021/6/22/82267207-e8a3-47f3-9f38-5561e36ccbbe1624358926580-Roadster-Women-Green-T-shirt-7911624358926077-5.jpg"",""https://assets.myntassets.com/assets/images/14342318/2021/6/22/82267207-e8a3-47f3-9f38-5561e36ccbbe1624358926580-Roadster-Women-Green-T-shirt-7911624358926077-5.jpg"",""https://assets.myntassets.com/f_auto,h_150,q_auto:best,w_112/assets/images/14342370/2021/7/14/1c83449a-bdca-407f-a835-fa156d0c49831626253677338-Roadster-Women-T-shirts-211626253676746-1.jpg"",""https://assets.myntassets.com/f_webp,h_560,q_90,w_420/v1/assets/images/8338987/2019/4/9/eb071e11-71e5-4dfe-9f79-6b9cf07a2cf81554790118312-Roadster-Women-Rust-Printed-Round-Neck-T-shirt-5931554790116-1.jpg""]","This Women's green T-shirt features a solid color design with a regular length and a classic round neck. It comes with short, regular sleeves for comfort and ease of movement. Crafted from knitted cotton fabric, this T-shirt offers a soft and breathable feel, making it ideal for everyday wear.",Roadster,"{""product_specification"": [{""Fabric"":""Cotton""}, {""Fit"":""Regular Fit""}, {""Length"":""Regular""}, {""Main Trend"":""Typography or Slogan Print""}, {""Multipack Set"":""Single""}, {""Neck"":""Round Neck""}, {""Number of Pockets"":""1""}, {""Occasion"":""Casual""}, {""Pattern"":""Solid""}, {""Pattern Coverage"":""Placement""}, {""Sleeve Length"":""Short Sleeves""}]}",Clothing,Women's Clothing,T-shirts,Roadster T-shirts,,,W,66.0944206,
CL13072,Levi's Women's Perfect Crewneck Tee Shirt,Clothing >> Women's Clothing >> T-shirts >> Levi's T-shirts,2245,1242,"[""https://m.media-amazon.com/images/I/41UCO-82QXL._AC_SR38,50_.jpg"",""https://m.media-amazon.com/images/I/31v088el9dL._AC_SR38,50_.jpg"",""https://m.media-amazon.com/images/I/31QGsKEs18L._AC_SR38,50_.jpg"",""https://m.media-amazon.com/images/I/31lsEzXp3gL._AC_SR38,50_.jpg""]","The Levi's Women's Perfect Crewneck Tee Shirt is a wardrobe staple designed for comfort, versatility, and timeless style. Featuring a classic crewneck design, this tee offers a casual yet chic look suitable for various occasions. ",Levi's ,"{""product_specification"": [{""Fabric type"":""100% Cotton""}, {""Care instructions"":""Machine Wash""}, {""Origin"":""Imported""}, {""Closure type"":""Pull On""}, {""Neck style"":""Crewneck""}, {""Fit"":""Regular fit""}]}",Clothing,Women's Clothing,T-shirts,Levi's T-shirts,,,W,44.67706013,
