pid,product_name,product_category_tree,retail_price,discounted_price,image,description,brand,product_specifications,section,category,subcategory1,subcategory2,subcategory3,subcategory4,bias,sale_percentage,tags
FG30905,"Unibic Cookies, Assorted Cookies",Food & Grocery >> Snacks >> Biscuits & Cookies >> Cookies,300,225,"[""https://m.media-amazon.com/images/I/81EgwRfgLiL._SX679_.jpg""]","The UNIBIC assorted cookies combo pack is the perfect gift for any occasion, offering ten different flavors with zero trans fat, making it suitable for vegetarians. Serve these delicious biscuits to your guests and loved ones, ensuring a memorable experience for everyone.",Unibic,"{""product_specification"": [{""Type"":""Assorted Cookies""}, {""Net Weight"":""75 g (Pack of 10)""}, {""Flavours"":""Choco Chip, Butter, Fruit & Nut, Honey Oatmeal, Cashew, Jeera, Digestive""}]}",Food & Grocery,Snacks,Biscuits & Cookies,Cookies,,,A,25,
FG70332,Evum Handmade Premium Ragi & Oat Cookies,Food & Grocery >> Snacks >> Biscuits & Cookies >> Cookies,400,400,"[""https://m.media-amazon.com/images/I/81ApCsmfRmL._SX679_PIbundle-2,TopRight,0,0_AA679SH20_.jpg""]","Healthy & Tasty Guilt-free Snacks, Freshly Baked Delicious & Crunchy Oats Cookies/Biscuits, No Maida, No Butter, No Refined Sugar, No Preservatives",Evum,"{""product_specification"": [{""Occasion"":""New Baby, Anniversary, Thank, Thanksgiving""}, {""Flavour"":""Ragi & Oats""}, {""Diet Type"":""Vegetarian""}, {""Number of Items"":""2""}, {""Net Quantity"":""280.0 gram""}, {""Brand"":""EVUM""}, {""Item Weight"":""140 Grams""}, {""Number of Pieces"":""2""}, {""Item Form"":""Bar""}, {""Country/Region Of Origin"":""Mexico""}]}",Food & Grocery,Snacks,Biscuits & Cookies,Cookies,,,A,0,
FG16378,ORION Strawberry Chocolates Cookies,Food & Grocery >> Snacks >> Biscuits & Cookies >> Cookies,400,265,"[""https://m.media-amazon.com/images/I/61N7YN4VGnL._SX679_.jpg""]","Indulge in Orion Strawberry Choco Pie, with a luscious strawberry jam center and real strawberry content of 39%. Ideal for snacking anytime, these treats are perfect for festive gifting or enjoying with loved ones at home.",ORION,"{""product_specification"": [{""Flavour"":""Chocolates""}, {""Diet Type"":""Vegetarian""}, {""Number of Items"":""1""}, {""Net Quantity"":""560.0 gram""}, {""Brand"":""ORION""}, {""Item Weight"":""560 Grams""}, {""Number of Pieces"":""20""}, {""Item Form"":""Bar""}]}",Food & Grocery,Snacks,Biscuits & Cookies,Cookies,,,A,33.75,
FG11499,Lotus Biscoff Belgian Speculoos Sandwich Cookies Biscoff Cream,Food & Grocery >> Snacks >> Biscuits & Cookies >> Cookies,2388,2268,"[""https://m.media-amazon.com/images/I/81WDGI7P87L._SX679_PIbundle-12,TopRight,0,0_AA679SH20_.jpg""]","Indulge in Lotus Biscoff's irresistible sandwich biscuits, featuring two crunchy cookies with a luscious Biscoff cream filling. Perfect for sharing and crafted with vegan-friendly ingredients, free from artificial colors and preservatives.",Lotus Biscoff,"{""product_specification"": [{""Flavour"":""Caramel""}, {""Diet Type"":""Vegetarian""}, {""Number of Items"":""12""}, {""Net Quantity"":""1320.0 gram""}, {""Brand"":""LOTUS BISCOFF""}, {""Item Weight"":""110 Grams""}, {""Number of Pieces"":""11""}, {""Item Form"":""Bar""}]}",Food & Grocery,Snacks,Biscuits & Cookies,Cookies,,,A,5.025125628,
FG74971,Marie Gold Good Day Cashew Cookies,Food & Grocery >> Snacks >> Biscuits & Cookies >> Cookies,550,484,"[""https://m.media-amazon.com/images/I/61rwpt0q8ZL._SX679_PIbundle-10,TopRight,0,0_AA679SH20_.jpg""]","Britannia Good Day Cashew Cookies are delicious crunchy cookies blended with a nutty flavour of cashews. 100% vegetarian, cashews cookies satisfy your cravings between meals. Britannia biscuits, cookies, cakes and rusk are a perfect companion for your tea.",Marie Gold,"{""product_specification"": [{""Flavour"":""Cashew""}, {""Number of Items"":""10""}, {""Net Quantity"":""1000.0 gram""}, {""Brand"":""Marie Gold""}, {""Item Weight"":""1000 Grams""}, {""Number of Pieces"":""10""}, {""Item Form"":""Bar""}, {""Speciality"":""Suitable for vegetarians""}]}",Food & Grocery,Snacks,Biscuits & Cookies,Cookies,,,A,12,
FG87008,Sunfeast Yumfills Whoopie Chocolates Chip,Food & Grocery >> Snacks >> Biscuits & Cookies >> Cookies,170,114,"[""https://m.media-amazon.com/images/I/81t0-RJxAdL._SX679_.jpg""]","Indulge in Sunfeast Yumfills Whoopie Chocolates Chip biscuits, perfect for a delightful snack. Made with premium ingredients, these egg-free biscuits offer a delicious Chocolatesy experience with every bite.",Sunfeast,"{""product_specification"": [{""Brand"":""Sunfeast""}, {""Flavor"":""Chocolates Chip""}, {""Diet Type"":""Vegetarian""}, {""Item Form"":""Solid""}, {""Net Quantity"":""300 grams""}]}",Food & Grocery,Snacks,Biscuits & Cookies,Cookies,,,A,32.94117647,
FG18609,"Mcvitie's Digestive High Fibre Biscuits with Goodness of Wholewheat,Super Saver Family Pack, 959.1g, Super Saver Family Pack",Food & Grocery >> Snacks >> Biscuits & Cookies >> Biscuits >> Digestive Biscuits,398,298,"[""https://m.media-amazon.com/images/I/81vvZ-G9p6L._SX679_PIbundle-2,TopRight,0,0_AA679SH20_.jpg""]","Digestive biscuits with the goodness of wholewheat, in a super saver family pack. Each pack weighs 959.1g.",Mcvitie's,"{""product_specification"": [{""Brand"":""Mcvitie's""}, {""Type"":""Digestive Biscuits""}, {""Flavour"":""Wholewheat""}, {""Net Weight"":""959.1 g (Pack of 2)""}]}",Food & Grocery,Snacks,Biscuits & Cookies,Biscuits,Digestive Biscuits,,A,25.12562814,
FG50369,"Sunfeast Dark Fantasy Biscuits - Choco Fills, 300g (Pack of 5) Promo Pack",Food & Grocery >> Snacks >> Biscuits & Cookies >> Biscuits >> Cream,600,600,"[""https://m.media-amazon.com/images/I/81a70D08GhL._SX679_PIbundle-5,TopRight,0,0_SX679SY531SH20_.jpg""]","Indulge in the rich and decadent taste of Sunfeast Dark Fantasy Biscuits - Choco Fills, featuring a luscious Chocolates filling encased in crisp biscuit shells. This pack of 5 offers convenience and plenty of delicious treats to satisfy your Chocolates cravings.",Sunfeast,"{""product_specification"": [{""Flavour"":""Choco Fills""}, {""Number of Items"":""5""}, {""Net Quantity"":""1500.0 gram""}, {""Brand"":""Sunfeast""}, {""Item Weight"":""300 Grams""}, {""Item Form"":""Bar""}, {""Speciality"":""Suitable for vegetarians""}, {""Item Firmness Description"":""Medium""}, {""Package Type"":""Pouch""}]}",Food & Grocery,Snacks,Biscuits & Cookies,Biscuits,Cream,,A,0,
FG50380,Oreo Mini Oreo Chocolates,Food & Grocery >> Snacks >> Biscuits & Cookies >> Biscuits >> Cream,520,325,"[""https://m.media-amazon.com/images/I/91ooQqZ3MzL._SX679_.jpg""]","Indulge in the Oreo Mini Chocolates 10 Packs Biscuit Box, offering rich Chocolates crème between crunchy biscuits. Perfect for home snacking or sharing with loved ones, it contains 10 units of Cadbury Oreo Chocolates creme biscuits, ideal for a delightful treat.",Oreo,"{""product_specification"": [{""Flavour"":""Chocolates""}, {""Diet Type"":""Vegetarian""}, {""Number of Items"":""1""}, {""Net Quantity"":""204.0 gram""}, {""Brand"":""Oreo""}, {""Item Weight"":""204 Grams""}, {""Number of Pieces"":""1""}, {""Item Form"":""Bar""}, {""Speciality"":""No Artificial Flavor, No Artificial Colours""}]}",Food & Grocery,Snacks,Biscuits & Cookies,Biscuits,Cream,,A,37.5,
FG30587,Early Foods - Biscuits combo pack - Ragi & Amaranth Jaggery Cookies,Food & Grocery >> Snacks >> Biscuits & Cookies >> Biscuits,398,320,"[""https://m.media-amazon.com/images/I/61wHv8+NfXL._SX679_PIbundle-2,TopRight,0,0_AA679SH20_.jpg""]","Combo pack of Ragi & Amaranth Jaggery Cookies, each pack weighing 150g. These biscuits are sugar-free.",Early Foods,"{""product_specification"": [{""Brand"":""Early Foods""}, {""Type"":""Ragi & Amaranth Jaggery Cookies""}, {""Net Weight"":""150 g X 2""}, {""Speciality"":""Sugar-Free""}]}",Food & Grocery,Snacks,Biscuits & Cookies,Biscuits,,,A,19.59798995,
FG69165,"Fresho Onion, 5 kg Multipack",Food & Grocery >> Fruits & Vegetables >> Vegetables,253,189,"[""https://www.bigbasket.com/media/uploads/p/l/1201414_1-fresho-onion.jpg""]","Onion can fill your kitchen with a thick spicy aroma. It is a common base vegetable in most Indian dishes, thanks to the wonderful flavor that it adds to any dish. Product image shown is for representation purpose only, the actually product may vary based on season, produce & availability.",Fresho,"{""product_specification"": [{""Net Weight"":""5kg""}, {""Nature"":""Organic""}, {""Product Type"":""Multipack""}, {""Country of Origin"":""India""}]}",Food & Grocery,Fruits & Vegetables,Vegetables,,,,A,25.29644269,"[""#healthy""]"
FG17692,"Fresho Potato - Jyoti New, 10 kg",Food & Grocery >> Fruits & Vegetables >> Vegetables,340,246,"[""https://www.bigbasket.com/media/uploads/p/l/40048455_8-fresho-potato-jyoti.jpg""]","Potatoes are filling, reasonable in calories, non-fattening, and are nutrient dense, which means you obtain many nutrients for the amount of calories they have. It has a rich and smooth texture. It is a good supply of carbohydrates, dietary fiber and some minerals like potassium, copper, magnesium and iron. It is also rich in phytochemical antioxidants like flavonoids, other B vitamins as well as folate.",Fresho,"{""product_specification"": [{""Net Weight"":""10kg""}, {""Nature"":""Organic""}, {""Variety"":""Jyoti""}, {""Country of Origin"":""India""}]}",Food & Grocery,Fruits & Vegetables,Vegetables,,,,A,27.64705882,"[""#healthy""]"
FG85713,Manna 100% Steel Cut Oats 3kg Gluten Free Diabetic Friendly High Protein & Fibre,Food & Grocery >> Cereals >> Oats,898,649,"[""https://m.media-amazon.com/images/I/714hzsaeIGL._SX679_PIbundle-2,TopRight,0,0_AA679SH20_.jpg""]","Indulge in the health benefits of Quaker Oats, rich in fiber, protein, and essential nutrients, ideal for a wholesome breakfast or snack. Made from 100% whole grain, it's a nutritious addition to your diet, promoting heart health and muscle maintenance.",Manna,"{""product_specification"": [{""Brand"":""Manna""}, {""Diet Type"":""Vegetarian""}, {""Number of Items"":""2""}, {""Net Quantity"":""3000.0 gram""}, {""Item Weight"":""3 Kilograms""}]}",Food & Grocery,Cereals,Oats,,,,A,27.72828508,"[""#healthy""]"
FG56289,"Tata Soulfull Masala Oats+ With Millets, Mast Masala, 500g, Real Vegetables, 25% Millets, Non Sticky, Evening Snack, Healthy Snack",Food & Grocery >> Cereals >> Oats,350,346,"[""https://m.media-amazon.com/images/I/51tAti76IAL._SX300_SY300_QL70_FMwebp_.jpg""]","Drive your evening snack craving away, the DESI-LICIOUS way with TATA SOULFULL MASALA OATS+. Tata Soulfull Masala Oats+ Mast Masala combines the goodness of wholegrain oats, crunchy Indian millets (jowar & Navane), desi masalas and 100% real veggies. It’s a mouth-watering desi snack bursting with taste and texture! Ready in just 4 minutes, this ready to eat Masala Oats is super convenient to prepare and also high in fiber and a good source of protein.",Tata Soulfull,"{""product_specification"": [{""Brand"":""Tata Soulfull""}, {""Sub Brand"":""Soulfull""}, {""Diet Type"":""Vegetarian""}, {""Flavour"":""Mast Masala""}, {""Age Range (Description)"":""Adult""}, {""Item Form"":""Flaked""}, {""Speciality"":""Vegetarian""}, {""Net Quantity"":""500.0 gram""}, {""Number of Items"":""1""}, {""Package Information"":""Bag""}]}",Food & Grocery,Cereals,Oats,,,,A,1.142857143,"[""#healthy""]"
FG66801,"ALPINO High Protein Super Rolled Oats Chocolates - Rolled Oats, Natural Peanut Butter & Cocoa Powder – 21g Protein, No Added Sugar & Salt, Gluten Free – Peanut Butter & Cocoa Coated Oats (1 KG)",Food & Grocery >> Cereals >> Oats,549,493,"[""https://m.media-amazon.com/images/I/81xmrQ9UWKL._SX679_.jpg""]","Enjoy the nutritious blend of natural peanut butter, rolled oats, and cocoa in this high-protein super oats, with no added sugar or preservatives. Packed with 21g of protein, essential dietary fibers, and a variety of vitamins and minerals, it's a wholesome choice for a healthy and satisfying snack or breakfast.",Alpino,"{""product_specification"": [{""Brand"":""Alpino""}, {""Diet Type"":""Vegetarian""}, {""Flavour"":""Chocolates""}, {""Age Range (Description)"":""Adult""}, {""Item Form"":""Flaked""}, {""Speciality"":""High Protein, No Added Sugar, Vegan""}, {""Net Quantity"":""1000.0 gram""}, {""Number of Items"":""1""}, {""Package Information"":""Bag""}, {""Item Weight"":""1000 Grams""}]}",Food & Grocery,Cereals,Oats,,,,A,10.2003643,"[""#healthy""]"
FG61149,Kellogg's Muesli,Food & Grocery >> Cereals >> Muesli & Granola,460,416,"[""https://m.media-amazon.com/images/I/71BsckBgy3L._SX679_.jpg""]","Kellogg's Fruit and Nut Muesli a vegetarian-friendly, flaked muesli suitable for adults, boasting a delightful fruit and nut flavor. Packed with high protein, fiber, and whole grains, this 750g bag offers a nutritious breakfast option.",Kellogg's,"{""product_specification"": [{""Brand"":""Kellogg's""}, {""Diet Type"":""Vegetarian""}, {""Flavour"":""Fruit and Nut""}, {""Age Range (Description)"":""Adult""}, {""Item Form"":""Flaked""}, {""Speciality"":""High Protein, High Fibre, Whole Grain""}, {""Net Quantity"":""750.0 gram""}, {""Number of Items"":""1""}, {""Package Information"":""Bag""}, {""Item Weight"":""750 Grams""}]}",Food & Grocery,Cereals,Muesli & Granola,,,,A,9.565217391,"[""#healthy""]"
FG50326,Kellogg's Chocos 1.10kg with Whole Grain,Food & Grocery >> Cereals >> Chocos,499,451,"[""https://m.media-amazon.com/images/I/615fyubU9dL._SX679_.jpg""]","Kellogg's Chocos, High in Protein, B Vitamins, Calcium and Iron, 1.2 kg",Kellogg's,"{""product_specification"": [{""Brand"":""Kellogg's""}, {""Diet Type"":""Vegetarian""}, {""Flavour"":""Chocos""}, {""Age Range (Description)"":""Child""}, {""Item Form"":""Powder""}, {""Speciality"":""Vegetarian""}, {""Net Quantity"":""1200.0 gram""}, {""Number of Items"":""1""}, {""Package Information"":""Box""}, {""Item Weight"":""1.2 Kilograms""}]}",Food & Grocery,Cereals,Chocos,,,,A,9.619238477,
FG22018,Fanta Orange Flavoured Drink,Food & Grocery >> Beverages >> Soft Drinks,480,480,"[""https://m.media-amazon.com/images/I/71wZA448qKL._SX679_PIbundle-12,TopRight,0,0_AA679SH20_.jpg""]","Fanta was created during world war II in nazi Germany by the German coca cola (gmbh) bottling company. Using apple fibre left over from lollipops and whey, from cheese makers, Fanta was created and became quite popular.",Fanta,"{""product_specification"": [{""Brand"":""Fanta""}, {""Item Form"":""Lollipop""}, {""Flavour"":""Orange""}, {""Number of Items"":""12""}, {""Package Information"":""Can""}, {""Item Volume"":""3840 Millilitres""}, {""Net Quantity"":""320.0 millilitre""}, {""Speciality"":""Vegetarian""}, {""Age Range (Description)"":""Adult""}, {""Caffeine Content"":""caffeinated""}]}",Food & Grocery,Beverages,Soft Drinks,,,,A,0,
FG13266,Frooti Mango Drink 125ml (Pack of 40) Unique,Food & Grocery >> Beverages >> Soft Drinks,400,400,"[""https://m.media-amazon.com/images/I/71yRkNnG6vL._SX679_.jpg""]","Quench your thirst with the refreshing taste of Frooti Mango Drink, now available in a convenient pack of 40. Indulge in the unique and irresistible flavor of ripe mangoes packed into each 125ml serving.",Generic,"{""product_specification"": [{""Number of Items"":""1""}, {""Net Quantity"":""40.00 count""}, {""Brand"":""Generic""}, {""Flavour"":""Mango""}, {""Speciality"":""Antioxidant""}, {""Item Form"":""Mango Drink""}, {""Package Information"":""Bottle""}, {""Item Weight"":""5.3 Kilograms""}, {""Item Volume"":""125 Millilitres""}, {""Diet Type"":""Vegetarian""}]}",Food & Grocery,Beverages,Soft Drinks,,,,A,0,
FG52123,"Cadbury Bournvita 5 Star Magic Nutrition Drink, 750 g Pouch",Food & Grocery >> Beverages >> Nutrient Drinks,405,352,"[""https://m.media-amazon.com/images/I/614FIW5c6HL._SX679_.jpg""]","Cadbury Bournvita 5 Star Magic Nutrition Drink with caramel flavour is a scientifically designed formula, crafted by nutritionists with a bundle of nutrients that are known to support Physical strength (Calcium, Vitamin D and Magnesium are known to maintain Bone and Muscle health); Mental Strength (Iron, Iodine and Zinc which help in normal cognitive functions);",BOURNVITA,"{""product_specification"": [{""Brand"":""BOURNVITA""}, {""Item Weight"":""750 Grams""}, {""Item Form"":""Powder""}, {""Package Information"":""Pouch""}, {""Diet Type"":""Vegetarian""}]}",Food & Grocery,Beverages,Nutrient Drinks,,,,A,13.08641975,"[""#healthy""]"
FG96774,Tang Pineapple Imported Flavored Drink,Food & Grocery >> Beverages >> Juices >> Squash & Syrups,1300,1300,"[""https://m.media-amazon.com/images/I/81ExNhfhKpL._SX679_.jpg""]","Enjoy the tropical taste of Tang Pineapple Imported Flavored Drink, conveniently packed in a 2 kg tub. Just add water to create refreshing pineapple-flavored beverages, suitable for vegetarians.",Tang,"{""product_specification"": [{""Net Weight"":""2 kg""}, {""Flavour"":""Pineapple""}]}",Food & Grocery,Beverages,Juices,Squash & Syrups,,,A,0,"[""#summer""]"
FG14807,Tang Lemon Mint Flavoured Instant Powder Drink Juice,Food & Grocery >> Beverages >> Juices >> Squash & Syrups,375,375,"[""https://m.media-amazon.com/images/I/61LmADRLDRL._SX679_.jpg""]","Stay refreshed and hydrated with Tang Lemon Instant Drink Mix, perfect for kids who are hesitant to drink water. Beat the summer heat with Tang's easy-to-prepare and refreshing taste, providing a quick and delicious beverage option for all occasions.",Tang,"{""product_specification"": [{""Net Weight"":""375 Grams""}, {""Item Form"":""Powder""}, {""Package Information"":""Packet""}, {""Allergen Information"":""Wheat Free, Dairy Free, Gluten Free, Gelatine Free, Celery Free""}]}",Food & Grocery,Beverages,Juices,Squash & Syrups,,,A,0,"[""#summer""]"
FG83030,Tang Orange - 2.5kg,Food & Grocery >> Beverages >> Juices >> Squash & Syrups,1699,1500,"[""https://m.media-amazon.com/images/I/91B5UMaERGL._SX679_.jpg""]","Enjoy the refreshing taste of Tang Orange, a convenient powdered drink mix perfect for making delicious orange-flavored beverages. This 2.5kg pack ensures you have plenty of Tang on hand for quenching your thirst at any time.",Tang,"{""product_specification"": [{""Brand"":""Tang""}, {""Item Weight"":""2500 Grams""}, {""Item Form"":""Powder""}, {""Package Information"":""Tub""}, {""Package Weight"":""2.69 Kilograms""}]}",Food & Grocery,Beverages,Juices,Squash & Syrups,,,A,11.71277222,"[""#summer""]"
FG74020,Tang Orange Instant Drink Mix,Food & Grocery >> Beverages >> Juices >> Squash & Syrups,750,750,"[""https://m.media-amazon.com/images/I/71AepRDO6gL._SY466_.jpg""]","Tang comes in refreshing orange flavour. Keep everyone refreshed this summer with Tang and its great fruit taste with the goodness of vitamins A, B, C and iron. A glass approximately 180ml of Tang gives your child 60 percent of vitamin C required for the entire day.",Tang,"{""product_specification"": [{""Net Weight"":""750 g X 3""}, {""Flavour"":""Orange""}]}",Food & Grocery,Beverages,Juices,Squash & Syrups,,,A,0,"[""#summer""]"
FG53155,Raw Pressery Pomegranate Juice,Food & Grocery >> Beverages >> Juices,900,900,"[""https://m.media-amazon.com/images/I/41GMIvACE0L._SX425_.jpg""]",Raw Pressery Pomegranate juice improves blood flow and blood pressure to give you a healthy heart.This sparkling red juice controls the blood bad cholesterol level.,Raw Pressery,"{""product_specification"": [{""Number of Items"":""2""}, {""Net Quantity"":""2000.0 millilitre""}, {""Brand"":""Raw Pressery""}, {""Flavour"":""Pomegranate""}, {""Speciality"":""No Artificial Flavors, Vegetarian, No Artificial Colors, No Added Sugar""}, {""Item Form"":""Liquid""}, {""Package Information"":""Bottle""}, {""Item Weight"":""2000 Grams""}, {""Item Volume"":""2000 Millilitres""}, {""Diet Type"":""Vegetarian""}]}",Food & Grocery,Beverages,Juices,,,,A,0,"[""#summer""]"
FG94531,Tropicana Mango Delight Fruit Juice,Food & Grocery >> Beverages >> Juices,345,345,"[""https://m.media-amazon.com/images/I/81OmmM2Sb5L._SX679_PIbundle-3,TopRight,0,0_AA679SH20_.jpg""]",,Tropicana,"{""product_specification"": [{""Number of Items"":""3""}, {""Net Quantity"":""3000.0 millilitre""}, {""Brand"":""Tropicana""}, {""Flavour"":""Mango""}, {""Speciality"":""Vegetarian""}, {""Item Form"":""तरल""}, {""Package Information"":""Box""}, {""Item Volume"":""3 Litres""}, {""Package Weight"":""2.18 Kilograms""}]}",Food & Grocery,Beverages,Juices,,,,A,0,"[""#summer""]"
FG29009,Real Pomegranate Fruit Juice -1L (Pack of 2),Food & Grocery >> Beverages >> Juices,260,251,"[""https://m.media-amazon.com/images/I/81Vcnot0XwL._SX679_PIbundle-2,TopRight,0,0_AA679SH20_.jpg""]","Rich in Vitamin C, No Added Preservatives, No Artificial Colors & Flavours",Real,"{""product_specification"": [{""Number of Items"":""2""}, {""Net Quantity"":""2000.0 millilitre""}, {""Brand"":""DABUR""}, {""Flavour"":""Pomegranate""}, {""Speciality"":""natural""}, {""Item Form"":""Liquid""}, {""Package Information"":""Box""}, {""Age Range (Description)"":""Kid""}, {""Item Weight"":""100 Grams""}, {""Item Volume"":""2 Litres""}]}",Food & Grocery,Beverages,Juices,,,,A,3.461538462,"[""#summer""]"
FG83773,"Red Bull Energy Drink, 350 ml (24 Pack)",Food & Grocery >> Beverages >> Energy Drinks,3960,3366,"[""https://m.media-amazon.com/images/I/717feOuF+OL._SX679_PIbundle-24,TopRight,0,0_AA679SH20_.jpg""]","Stay energized and focused throughout the day with Red Bull Energy Drink, now in a convenient pack of 24 cans each containing 350 ml. Enjoy the iconic taste and revitalizing effects of Red Bull whenever you need a boost.",Red Bull,"{""product_specification"": [{""Brand"":""Red Bull""}, {""Item Form"":""Liquid""}, {""Flavour"":""Mixed fruit""}, {""Diet Type"":""Vegetarian""}, {""Number of Items"":""24""}, {""Package Information"":""Can""}, {""Item Volume"":""8400 Millilitres""}, {""Net Quantity"":""8400.0 millilitre""}, {""Item Weight"":""6000 Grams""}, {""Speciality"":""No preservatives, wheat free, suitable for Vegans, vegetarians, halal""}]}",Food & Grocery,Beverages,Energy Drinks,,,,A,15,"[""#summer""]"
FG79219,Glucon-D Nimbu Pani Glucose Powder With Free Sipper(1Kg),Food & Grocery >> Beverages >> Energy Drinks,380,380,"[""https://m.media-amazon.com/images/I/71AwkSCRvAL._SX679_.jpg""]","Glucon-D is one of the best glucose powders that is easily absorbed by the body to keep you charged and active during the screeching summers. If you are drained and tired by the summer heat, Glucon-D is here for your rescue.",Glucon-D,"{""product_specification"": [{""Brand"":""Glucon-D""}, {""Item Weight"":""1000 Grams""}, {""Caffeine Content"":""Caffeine Free""}, {""Item Form"":""Powder""}, {""Package Information"":""Pouch""}]}",Food & Grocery,Beverages,Energy Drinks,,,,A,0,"[""#summer""]"
EL66216,Realme Band,Electronics >> Wearable Devices >> Smart Bands >> Realme Smart Bands,2999,1499,"[""https://rukminim2.flixcart.com/image/128/128/ka2tmkw0/smart-band-tag/4/y/m/no-rma183-yes-android-ios-realme-yes-original-imafrq8cdfb4y68k.jpeg?q=70&crop=false""]","Realme Band offers a large color display, intelligent sports tracking, sleep quality monitoring, and personalized dial faces in a water-resistant design with convenient USB direct charging",Realme,"{""product_specification"": [{""Model Name"":""Band""}, {""Reading Type"":""Digital""}, {""Ideal For"":""Unisex""}, {""Material"":""Thermoplastic polyurethane (TPU)""}, {""Suitable For"":""Health, Lifestyle""}, {""Touch Enabled"":""Yes""}, {""Water Resistant"":""Yes""}]}",Electronics,Wearable Devices,Smart Bands,Realme Smart Bands,,,A,50.01667222,
EL67521,OnePlus Band,Electronics >> Wearable Devices >> Smart Bands >> OnePlus Smart Bands,2799,2799,"[""https://rukminim2.flixcart.com/image/128/128/kjiwfbk0/smart-band-tag/h/y/r/no-regular-yes-w101in-android-ios-oneplus-yes-original-imafz2kf6gzgjjze.jpeg?q=70&crop=false""]","Stay connected to your health and fitness with the OnePlus Band, featuring sleep and heart rate tracking, exercise monitoring, and a stylish AMOLED display. With 5ATM and IP68 ratings, it's waterproof and dust-resistant, allowing you to track your stats indoors and outdoors effortlessly.",OnePlus,"{""product_specification"": [{""Model Number"":""W101IN""}, {""Model Name"":""Band""}, {""Reading Type"":""Digital""}, {""Ideal For"":""Unisex""}, {""Material"":""Thermoplastic polyurethane (TPU)""}, {""Suitable For"":""Health, Lifestyle""}, {""Touch Enabled"":""Yes""}, {""Water Resistant"":""Yes""}, {""Water Resistant Rating"":""IP68""}]}",Electronics,Wearable Devices,Smart Bands,OnePlus Smart Bands,,,A,0,
EL73263,Mi Band 6,Electronics >> Wearable Devices >> Smart Bands >> Mi Smart Bands,3999,3049,"[""https://rukminim1.flixcart.com/blobio/1160/1160/imr/blobio-imr_58954d6806324a8caf40ddae256a1681.jpeg?q=90""]","Experience vibrant visuals on the 1.56"" AMOLED Touch Screen, complemented by a two-week battery life and essential health tracking features like SpO2 and 24Hr Heart Rate Monitoring. With 30 activity tracking options and 5ATM water resistance, it's your versatile companion for fitness and daily life.",Mi,"{""product_specification"": [{""Model Number"":""XMSH15HM""}, {""Model Name"":""Smart Band 6""}, {""Reading Type"":""Digital""}, {""Ideal For"":""Unisex""}, {""Material"":""Thermoplastic polyurethane (TPU)""}, {""Suitable For"":""Men And Women""}, {""Touch Enabled"":""Yes""}, {""Water Resistant"":""Yes""}, {""Water Resistant Rating"":""5ATM""}, {""Function"":""Calorie Counts, Steps Count, Heart Rate Monitoring, Sleep Monitoring, Stress Monitoring, Camera Control, Music Control, Notifications, Idle Alerts, Event Reminder""}, {""Dial Shape"":""Oval""}, {""Compatible Devices"":""iPhone, Android Phones""}, {""Foot Pods Included"":""No""}, {""Sales Package"":""Fitness Tracker, Wrist Band, Charging Cable, User Manual""}]}",Electronics,Wearable Devices,Smart Bands,Mi Smart Bands,,,A,23.75593898,
